{
  "source_format": "echoes-campaign-map-source",
  "source_version": 1,
  "author": "Angelis Pseftis",
  "mission_code": "M05",
  "map_id": "terms-of-continuance-corridor",
  "operation_mode": "CampaignTermsOfContinuance",
  "production_brief": {
    "mission_requirement": "SPEC-MSN-005",
    "map_concepts_reference": "MapConcepts#M05"
  },
  "grid": {
    "width_tiles": 64,
    "height_tiles": 64,
    "index_formula": "y*width+x",
    "coordinate_origin": "southwest"
  },
  "base_terrain": "open",
  "terrain_region_ops": [
    {
      "id": "west-treaty-wall",
      "op": "block",
      "x0": 2,
      "x1": 11,
      "y0": 30,
      "y1": 34
    },
    {
      "id": "central-treaty-wall-west",
      "op": "block",
      "x0": 17,
      "x1": 27,
      "y0": 30,
      "y1": 34
    },
    {
      "id": "central-treaty-wall-east",
      "op": "block",
      "x0": 37,
      "x1": 47,
      "y0": 30,
      "y1": 34
    },
    {
      "id": "east-treaty-wall",
      "op": "block",
      "x0": 53,
      "x1": 61,
      "y0": 30,
      "y1": 34
    },
    {
      "id": "meridian-observation-bank",
      "op": "block",
      "x0": 4,
      "x1": 10,
      "y0": 42,
      "y1": 48
    },
    {
      "id": "kharuun-observation-bank",
      "op": "block",
      "x0": 53,
      "x1": 59,
      "y0": 42,
      "y1": 48
    },
    {
      "id": "southern-route-separation",
      "op": "block",
      "x0": 0,
      "x1": 63,
      "y0": 60,
      "y1": 61
    },
    {
      "id": "local-deployment-clearance",
      "op": "open",
      "x0": 5,
      "x1": 16,
      "y0": 5,
      "y1": 17
    },
    {
      "id": "opponent-deployment-clearance",
      "op": "open",
      "x0": 47,
      "x1": 59,
      "y0": 47,
      "y1": 58
    }
  ],
  "founding_doctrine_variants": [
    {
      "doctrine": "Harvest",
      "terrain_region_ops": [
        {
          "id": "harvest-edge-aperture",
          "op": "open",
          "x0": 8,
          "x1": 11,
          "y0": 60,
          "y1": 61
        }
      ],
      "expected_blocked_cell_count": 409
    },
    {
      "doctrine": "Preserve",
      "terrain_region_ops": [
        {
          "id": "preserve-edge-aperture",
          "op": "open",
          "x0": 29,
          "x1": 34,
          "y0": 60,
          "y1": 61
        },
        {
          "id": "preserve-west-crossing-closure",
          "op": "block",
          "x0": 12,
          "x1": 16,
          "y0": 31,
          "y1": 33
        },
        {
          "id": "preserve-east-crossing-closure",
          "op": "block",
          "x0": 48,
          "x1": 52,
          "y0": 31,
          "y1": 33
        }
      ],
      "expected_blocked_cell_count": 435
    },
    {
      "doctrine": "Reshape",
      "terrain_region_ops": [
        {
          "id": "reshape-edge-aperture",
          "op": "open",
          "x0": 51,
          "x1": 54,
          "y0": 60,
          "y1": 61
        }
      ],
      "expected_blocked_cell_count": 409
    }
  ],
  "required_clearance": [
    {
      "id": "resource-1",
      "x": 16,
      "y": 16,
      "half_extent_raw": 1024
    },
    {
      "id": "resource-2",
      "x": 21,
      "y": 13,
      "half_extent_raw": 1024
    },
    {
      "id": "resource-3",
      "x": 25,
      "y": 28,
      "half_extent_raw": 1024
    },
    {
      "id": "resource-4",
      "x": 33,
      "y": 22,
      "half_extent_raw": 1024
    },
    {
      "id": "resource-5",
      "x": 31,
      "y": 43,
      "half_extent_raw": 1024
    },
    {
      "id": "resource-6",
      "x": 43,
      "y": 36,
      "half_extent_raw": 1024
    },
    {
      "id": "resource-7",
      "x": 47,
      "y": 50,
      "half_extent_raw": 1024
    },
    {
      "id": "resource-8",
      "x": 52,
      "y": 45,
      "half_extent_raw": 1024
    },
    {
      "id": "harvest-relay",
      "x": 14,
      "y": 27,
      "half_extent_raw": 1024
    },
    {
      "id": "harvest-spine",
      "x": 14,
      "y": 39,
      "half_extent_raw": 1024
    },
    {
      "id": "harvest-extract",
      "x": 20,
      "y": 47,
      "half_extent_raw": 1024
    },
    {
      "id": "preserve-relay",
      "x": 32,
      "y": 27,
      "half_extent_raw": 1024
    },
    {
      "id": "preserve-spine",
      "x": 32,
      "y": 39,
      "half_extent_raw": 1024
    },
    {
      "id": "preserve-extract",
      "x": 32,
      "y": 47,
      "half_extent_raw": 1024
    },
    {
      "id": "reshape-relay",
      "x": 50,
      "y": 27,
      "half_extent_raw": 1024
    },
    {
      "id": "reshape-spine",
      "x": 44,
      "y": 38,
      "half_extent_raw": 1024
    },
    {
      "id": "reshape-extract",
      "x": 44,
      "y": 47,
      "half_extent_raw": 1024
    },
    {
      "id": "meridian-witness-spawn",
      "x": 20,
      "y": 24,
      "half_extent_raw": 1024
    },
    {
      "id": "kharuun-witness-spawn",
      "x": 23,
      "y": 24,
      "half_extent_raw": 1024
    },
    {
      "id": "opponent-pressure-a",
      "x": 48,
      "y": 56,
      "half_extent_raw": 1024
    },
    {
      "id": "opponent-pressure-b",
      "x": 51,
      "y": 56,
      "half_extent_raw": 1024
    },
    {
      "id": "future-well",
      "x": 32,
      "y": 29,
      "half_extent_raw": 1024
    }
  ],
  "required_passable": [
    {
      "id": "resource-1",
      "x": 16,
      "y": 16
    },
    {
      "id": "resource-2",
      "x": 21,
      "y": 13
    },
    {
      "id": "resource-3",
      "x": 25,
      "y": 28
    },
    {
      "id": "resource-4",
      "x": 33,
      "y": 22
    },
    {
      "id": "resource-5",
      "x": 31,
      "y": 43
    },
    {
      "id": "resource-6",
      "x": 43,
      "y": 36
    },
    {
      "id": "resource-7",
      "x": 47,
      "y": 50
    },
    {
      "id": "resource-8",
      "x": 52,
      "y": 45
    },
    {
      "id": "harvest-relay",
      "x": 14,
      "y": 27
    },
    {
      "id": "harvest-spine",
      "x": 14,
      "y": 39
    },
    {
      "id": "harvest-extract",
      "x": 20,
      "y": 47
    },
    {
      "id": "preserve-relay",
      "x": 32,
      "y": 27
    },
    {
      "id": "preserve-spine",
      "x": 32,
      "y": 39
    },
    {
      "id": "preserve-extract",
      "x": 32,
      "y": 47
    },
    {
      "id": "reshape-relay",
      "x": 50,
      "y": 27
    },
    {
      "id": "reshape-spine",
      "x": 44,
      "y": 38
    },
    {
      "id": "reshape-extract",
      "x": 44,
      "y": 47
    }
  ]
}
