{
  "source_format": "echoes-campaign-map-source",
  "source_version": 1,
  "author": "Angelis Pseftis",
  "mission_code": "M11",
  "map_id": "public-coalition-interface",
  "operation_mode": "CampaignNoNeutralLedger",
  "production_brief": {
    "mission_requirement": "SPEC-MSN-011",
    "map_concepts_reference": "MapConcepts#M11"
  },
  "grid": {
    "width_tiles": 64,
    "height_tiles": 64,
    "index_formula": "y*width+x",
    "coordinate_origin": "southwest"
  },
  "base_terrain": "open",
  "terrain_region_ops": [
    {
      "id": "west-public-break",
      "op": "block",
      "x0": 2,
      "x1": 12,
      "y0": 37,
      "y1": 40
    },
    {
      "id": "east-public-break",
      "op": "block",
      "x0": 52,
      "x1": 61,
      "y0": 37,
      "y1": 40
    },
    {
      "id": "north-route-divider",
      "op": "block",
      "x0": 19,
      "x1": 23,
      "y0": 22,
      "y1": 27
    },
    {
      "id": "south-route-divider",
      "op": "block",
      "x0": 41,
      "x1": 45,
      "y0": 51,
      "y1": 56
    },
    {
      "id": "southern-route-separation",
      "op": "block",
      "x0": 0,
      "x1": 63,
      "y0": 60,
      "y1": 61
    },
    {
      "id": "local-deployment-clearance",
      "op": "open",
      "x0": 5,
      "x1": 16,
      "y0": 5,
      "y1": 17
    },
    {
      "id": "opponent-deployment-clearance",
      "op": "open",
      "x0": 47,
      "x1": 59,
      "y0": 47,
      "y1": 58
    }
  ],
  "founding_doctrine_variants": [
    {
      "doctrine": "Harvest",
      "terrain_region_ops": [
        {
          "id": "harvest-edge-aperture",
          "op": "open",
          "x0": 8,
          "x1": 11,
          "y0": 60,
          "y1": 61
        }
      ],
      "expected_blocked_cell_count": 264
    },
    {
      "doctrine": "Preserve",
      "terrain_region_ops": [
        {
          "id": "preserve-edge-aperture",
          "op": "open",
          "x0": 29,
          "x1": 34,
          "y0": 60,
          "y1": 61
        }
      ],
      "expected_blocked_cell_count": 260
    },
    {
      "doctrine": "Reshape",
      "terrain_region_ops": [
        {
          "id": "reshape-edge-aperture",
          "op": "open",
          "x0": 51,
          "x1": 54,
          "y0": 60,
          "y1": 61
        }
      ],
      "expected_blocked_cell_count": 264
    }
  ],
  "required_clearance": [
    {
      "id": "resource-1",
      "x": 16,
      "y": 16,
      "half_extent_raw": 1024
    },
    {
      "id": "resource-2",
      "x": 21,
      "y": 13,
      "half_extent_raw": 1024
    },
    {
      "id": "resource-3",
      "x": 26,
      "y": 24,
      "half_extent_raw": 1024
    },
    {
      "id": "resource-4",
      "x": 38,
      "y": 24,
      "half_extent_raw": 1024
    },
    {
      "id": "resource-5",
      "x": 24,
      "y": 48,
      "half_extent_raw": 1024
    },
    {
      "id": "resource-6",
      "x": 40,
      "y": 48,
      "half_extent_raw": 1024
    },
    {
      "id": "resource-7",
      "x": 48,
      "y": 42,
      "half_extent_raw": 1024
    },
    {
      "id": "resource-8",
      "x": 52,
      "y": 45,
      "half_extent_raw": 1024
    },
    {
      "id": "harvest-route",
      "x": 18,
      "y": 30,
      "half_extent_raw": 1024
    },
    {
      "id": "preserve-route",
      "x": 32,
      "y": 30,
      "half_extent_raw": 1024
    },
    {
      "id": "reshape-route",
      "x": 46,
      "y": 30,
      "half_extent_raw": 1024
    },
    {
      "id": "life-contribution",
      "x": 18,
      "y": 35,
      "half_extent_raw": 1024
    },
    {
      "id": "transit-contribution",
      "x": 32,
      "y": 33,
      "half_extent_raw": 1024
    },
    {
      "id": "archive-contribution",
      "x": 46,
      "y": 35,
      "half_extent_raw": 1024
    },
    {
      "id": "meridian-evidence",
      "x": 26,
      "y": 43,
      "half_extent_raw": 1024
    },
    {
      "id": "kharuun-evidence",
      "x": 38,
      "y": 43,
      "half_extent_raw": 1024
    },
    {
      "id": "well",
      "x": 32,
      "y": 49,
      "half_extent_raw": 1024
    },
    {
      "id": "harvest-rally",
      "x": 18,
      "y": 56,
      "half_extent_raw": 1024
    },
    {
      "id": "preserve-rally",
      "x": 32,
      "y": 56,
      "half_extent_raw": 1024
    },
    {
      "id": "reshape-rally",
      "x": 32,
      "y": 43,
      "half_extent_raw": 1024
    },
    {
      "id": "ledger-verifier-spawn",
      "x": 18,
      "y": 22,
      "half_extent_raw": 1024
    }
  ],
  "required_passable": [
    {
      "id": "resource-1",
      "x": 16,
      "y": 16
    },
    {
      "id": "resource-2",
      "x": 21,
      "y": 13
    },
    {
      "id": "resource-3",
      "x": 26,
      "y": 24
    },
    {
      "id": "resource-4",
      "x": 38,
      "y": 24
    },
    {
      "id": "resource-5",
      "x": 24,
      "y": 48
    },
    {
      "id": "resource-6",
      "x": 40,
      "y": 48
    },
    {
      "id": "resource-7",
      "x": 48,
      "y": 42
    },
    {
      "id": "resource-8",
      "x": 52,
      "y": 45
    },
    {
      "id": "harvest-route",
      "x": 18,
      "y": 30
    },
    {
      "id": "preserve-route",
      "x": 32,
      "y": 30
    },
    {
      "id": "reshape-route",
      "x": 46,
      "y": 30
    },
    {
      "id": "life-contribution",
      "x": 18,
      "y": 35
    },
    {
      "id": "transit-contribution",
      "x": 32,
      "y": 33
    },
    {
      "id": "archive-contribution",
      "x": 46,
      "y": 35
    },
    {
      "id": "meridian-evidence",
      "x": 26,
      "y": 43
    },
    {
      "id": "kharuun-evidence",
      "x": 38,
      "y": 43
    },
    {
      "id": "well",
      "x": 32,
      "y": 49
    },
    {
      "id": "harvest-rally",
      "x": 18,
      "y": 56
    },
    {
      "id": "preserve-rally",
      "x": 32,
      "y": 56
    },
    {
      "id": "reshape-rally",
      "x": 32,
      "y": 43
    }
  ]
}
