{
  "source_format": "echoes-campaign-map-source",
  "source_version": 1,
  "author": "Angelis Pseftis",
  "mission_code": "M07",
  "map_id": "listening-spine-ridge",
  "operation_mode": "CampaignShapeOfSilence",
  "production_brief": {
    "mission_requirement": "SPEC-MSN-007",
    "map_concepts_reference": "MapConcepts#M07"
  },
  "grid": {
    "width_tiles": 64,
    "height_tiles": 64,
    "index_formula": "y*width+x",
    "coordinate_origin": "southwest"
  },
  "base_terrain": "open",
  "terrain_region_ops": [
    {
      "id": "ridge-west",
      "op": "block",
      "x0": 0,
      "x1": 5,
      "y0": 5,
      "y1": 43
    },
    {
      "id": "ridge-east",
      "op": "block",
      "x0": 53,
      "x1": 57,
      "y0": 18,
      "y1": 58
    },
    {
      "id": "ridge-crown",
      "op": "block",
      "x0": 19,
      "x1": 43,
      "y0": 54,
      "y1": 58
    },
    {
      "id": "southern-hollow",
      "op": "block",
      "x0": 26,
      "x1": 34,
      "y0": 8,
      "y1": 13
    },
    {
      "id": "southern-route-separation",
      "op": "block",
      "x0": 0,
      "x1": 63,
      "y0": 60,
      "y1": 61
    },
    {
      "id": "local-deployment-clearance",
      "op": "open",
      "x0": 5,
      "x1": 16,
      "y0": 5,
      "y1": 17
    },
    {
      "id": "opponent-deployment-clearance",
      "op": "open",
      "x0": 47,
      "x1": 59,
      "y0": 47,
      "y1": 58
    }
  ],
  "founding_doctrine_variants": [
    {
      "doctrine": "Harvest",
      "terrain_region_ops": [
        {
          "id": "harvest-edge-aperture",
          "op": "open",
          "x0": 8,
          "x1": 11,
          "y0": 60,
          "y1": 61
        }
      ],
      "expected_blocked_cell_count": 665
    },
    {
      "doctrine": "Preserve",
      "terrain_region_ops": [
        {
          "id": "preserve-edge-aperture",
          "op": "open",
          "x0": 29,
          "x1": 34,
          "y0": 60,
          "y1": 61
        }
      ],
      "expected_blocked_cell_count": 661
    },
    {
      "doctrine": "Reshape",
      "terrain_region_ops": [
        {
          "id": "reshape-edge-aperture",
          "op": "open",
          "x0": 51,
          "x1": 54,
          "y0": 60,
          "y1": 61
        }
      ],
      "expected_blocked_cell_count": 665
    }
  ],
  "required_clearance": [
    {
      "id": "resource-1",
      "x": 16,
      "y": 16,
      "half_extent_raw": 1024
    },
    {
      "id": "resource-2",
      "x": 21,
      "y": 13,
      "half_extent_raw": 1024
    },
    {
      "id": "resource-3",
      "x": 25,
      "y": 28,
      "half_extent_raw": 1024
    },
    {
      "id": "resource-4",
      "x": 33,
      "y": 22,
      "half_extent_raw": 1024
    },
    {
      "id": "resource-5",
      "x": 31,
      "y": 43,
      "half_extent_raw": 1024
    },
    {
      "id": "resource-6",
      "x": 43,
      "y": 36,
      "half_extent_raw": 1024
    },
    {
      "id": "resource-7",
      "x": 47,
      "y": 50,
      "half_extent_raw": 1024
    },
    {
      "id": "resource-8",
      "x": 52,
      "y": 45,
      "half_extent_raw": 1024
    },
    {
      "id": "harvest-anchor",
      "x": 14,
      "y": 28,
      "half_extent_raw": 1024
    },
    {
      "id": "harvest-confluence",
      "x": 14,
      "y": 50,
      "half_extent_raw": 1024
    },
    {
      "id": "preserve-anchor",
      "x": 32,
      "y": 28,
      "half_extent_raw": 1024
    },
    {
      "id": "preserve-confluence",
      "x": 32,
      "y": 50,
      "half_extent_raw": 1024
    },
    {
      "id": "reshape-anchor",
      "x": 48,
      "y": 20,
      "half_extent_raw": 1024
    },
    {
      "id": "reshape-confluence",
      "x": 25,
      "y": 50,
      "half_extent_raw": 1024
    },
    {
      "id": "memory-witness-a",
      "x": 20,
      "y": 24,
      "half_extent_raw": 1024
    },
    {
      "id": "memory-witness-b",
      "x": 23,
      "y": 24,
      "half_extent_raw": 1024
    },
    {
      "id": "future-well",
      "x": 32,
      "y": 32,
      "half_extent_raw": 1024
    }
  ],
  "required_passable": [
    {
      "id": "resource-1",
      "x": 16,
      "y": 16
    },
    {
      "id": "resource-2",
      "x": 21,
      "y": 13
    },
    {
      "id": "resource-3",
      "x": 25,
      "y": 28
    },
    {
      "id": "resource-4",
      "x": 33,
      "y": 22
    },
    {
      "id": "resource-5",
      "x": 31,
      "y": 43
    },
    {
      "id": "resource-6",
      "x": 43,
      "y": 36
    },
    {
      "id": "resource-7",
      "x": 47,
      "y": 50
    },
    {
      "id": "resource-8",
      "x": 52,
      "y": 45
    },
    {
      "id": "harvest-anchor",
      "x": 14,
      "y": 28
    },
    {
      "id": "harvest-confluence",
      "x": 14,
      "y": 50
    },
    {
      "id": "preserve-anchor",
      "x": 32,
      "y": 28
    },
    {
      "id": "preserve-confluence",
      "x": 32,
      "y": 50
    },
    {
      "id": "reshape-anchor",
      "x": 48,
      "y": 20
    },
    {
      "id": "reshape-confluence",
      "x": 25,
      "y": 50
    }
  ]
}
