{
  "source_format": "echoes-campaign-map-source",
  "source_version": 1,
  "author": "Angelis Pseftis",
  "mission_code": "M12",
  "map_id": "public-readback-demonstrator",
  "operation_mode": "CampaignFutureThatWon",
  "production_brief": {
    "mission_requirement": "SPEC-MSN-012",
    "map_concepts_reference": "MapConcepts#M12"
  },
  "grid": {
    "width_tiles": 64,
    "height_tiles": 64,
    "index_formula": "y*width+x",
    "coordinate_origin": "southwest"
  },
  "base_terrain": "open",
  "terrain_region_ops": [
    {
      "id": "demonstrator-west-rail",
      "op": "block",
      "x0": 1,
      "x1": 5,
      "y0": 12,
      "y1": 31
    },
    {
      "id": "demonstrator-east-rail",
      "op": "block",
      "x0": 51,
      "x1": 56,
      "y0": 12,
      "y1": 31
    },
    {
      "id": "readback-north-rib",
      "op": "block",
      "x0": 20,
      "x1": 24,
      "y0": 52,
      "y1": 57
    },
    {
      "id": "readback-south-rib",
      "op": "block",
      "x0": 40,
      "x1": 44,
      "y0": 52,
      "y1": 57
    },
    {
      "id": "southern-route-separation",
      "op": "block",
      "x0": 0,
      "x1": 63,
      "y0": 58,
      "y1": 59
    },
    {
      "id": "local-deployment-clearance",
      "op": "open",
      "x0": 5,
      "x1": 16,
      "y0": 5,
      "y1": 17
    },
    {
      "id": "opponent-deployment-clearance",
      "op": "open",
      "x0": 47,
      "x1": 59,
      "y0": 47,
      "y1": 58
    }
  ],
  "founding_doctrine_variants": [
    {
      "doctrine": "Harvest",
      "terrain_region_ops": [
        {
          "id": "harvest-edge-aperture",
          "op": "open",
          "x0": 5,
          "x1": 8,
          "y0": 58,
          "y1": 59
        }
      ],
      "expected_blocked_cell_count": 381
    },
    {
      "doctrine": "Preserve",
      "terrain_region_ops": [
        {
          "id": "preserve-edge-aperture",
          "op": "open",
          "x0": 28,
          "x1": 35,
          "y0": 58,
          "y1": 59
        }
      ],
      "expected_blocked_cell_count": 373
    },
    {
      "doctrine": "Reshape",
      "terrain_region_ops": [
        {
          "id": "reshape-edge-aperture",
          "op": "open",
          "x0": 55,
          "x1": 58,
          "y0": 58,
          "y1": 59
        }
      ],
      "expected_blocked_cell_count": 385
    }
  ],
  "required_clearance": [
    {
      "id": "resource-1",
      "x": 16,
      "y": 16,
      "half_extent_raw": 1024
    },
    {
      "id": "resource-2",
      "x": 21,
      "y": 13,
      "half_extent_raw": 1024
    },
    {
      "id": "resource-3",
      "x": 26,
      "y": 24,
      "half_extent_raw": 1024
    },
    {
      "id": "resource-4",
      "x": 38,
      "y": 24,
      "half_extent_raw": 1024
    },
    {
      "id": "resource-5",
      "x": 24,
      "y": 48,
      "half_extent_raw": 1024
    },
    {
      "id": "resource-6",
      "x": 40,
      "y": 48,
      "half_extent_raw": 1024
    },
    {
      "id": "resource-7",
      "x": 48,
      "y": 42,
      "half_extent_raw": 1024
    },
    {
      "id": "resource-8",
      "x": 52,
      "y": 45,
      "half_extent_raw": 1024
    },
    {
      "id": "meridian-readback",
      "x": 26,
      "y": 43,
      "half_extent_raw": 1024
    },
    {
      "id": "kharuun-readback",
      "x": 38,
      "y": 43,
      "half_extent_raw": 1024
    },
    {
      "id": "life-input",
      "x": 18,
      "y": 35,
      "half_extent_raw": 1024
    },
    {
      "id": "transit-input",
      "x": 32,
      "y": 33,
      "half_extent_raw": 1024
    },
    {
      "id": "archive-input",
      "x": 46,
      "y": 35,
      "half_extent_raw": 1024
    },
    {
      "id": "future-well",
      "x": 32,
      "y": 49,
      "half_extent_raw": 1024
    },
    {
      "id": "future-verifier-spawn",
      "x": 18,
      "y": 22,
      "half_extent_raw": 1024
    }
  ],
  "required_passable": [
    {
      "id": "resource-1",
      "x": 16,
      "y": 16
    },
    {
      "id": "resource-2",
      "x": 21,
      "y": 13
    },
    {
      "id": "resource-3",
      "x": 26,
      "y": 24
    },
    {
      "id": "resource-4",
      "x": 38,
      "y": 24
    },
    {
      "id": "resource-5",
      "x": 24,
      "y": 48
    },
    {
      "id": "resource-6",
      "x": 40,
      "y": 48
    },
    {
      "id": "resource-7",
      "x": 48,
      "y": 42
    },
    {
      "id": "resource-8",
      "x": 52,
      "y": 45
    },
    {
      "id": "meridian-readback",
      "x": 26,
      "y": 43
    },
    {
      "id": "kharuun-readback",
      "x": 38,
      "y": 43
    },
    {
      "id": "life-input",
      "x": 18,
      "y": 35
    },
    {
      "id": "transit-input",
      "x": 32,
      "y": 33
    },
    {
      "id": "archive-input",
      "x": 46,
      "y": 35
    },
    {
      "id": "future-well",
      "x": 32,
      "y": 49
    }
  ]
}
